School|School ID|Full Address|Enrollment|Rpt Type Long|Governance|Achievement_Score_Final|Progress_Score_Final|Climate_Score_Final|Overall_Score_Final|Latitude|Longitude|SafetyIncidentRate|SafetyScore
Academy for the Middle Years at Northwest|648|6000 Ridge Ave, Philadelphia, PA 19128|313|Middle School|District|33.0|49.0|71.0|51|40.0731656|-75.2429959|1.1182108626198084|93.0
Lankenau High School|654|201 Spring Lane, Philadelphia, PA 19128|352|High School|District|8.0|50.0|65.0|42|40.06155748487|-75.2529219710656|0.7102272727272728|96.0
Frankford High School|701|5000 Oxford Ave, Philadelphia, PA 19124|1088|High School|District|0.0|21.0|8.0|10|40.022541|-75.084532|4.204963235294118|75.0
Jay Cooke School|710|1300 W Louden St, Philadelphia, PA 19141|472|K8 School|District|2.0|0.0|11.0|4|||3.8665254237288136|77.0
Warren G. Harding School|711|2000 Wakeling St, Philadelphia, PA 19124|709|Middle School|District|1.0|48.0|11.0|22|40.013575|-75.073804|8.180535966149506|52.0
Samuel Fels High School|712|5500 Langdon St, Philadelphia, PA 19124|988|High School|District|1.0|20.0|10.0|11|40.0374943|-75.089197|5.769230769230768|66.0
General Louis Wagner School|713|1701 Chelten Ave, Philadelphia, PA 19126|521|Middle School|District|1.0|60.0|22.0|30|40.051277|-75.147144|2.7831094049904026|84.0
Juniata Park Academy|715|801 E Hunting Park Ave, Philadelphia, PA 19124|1189|K8 School|District|12.0|4.0|46.0|19|40.01260895|-75.111761864511|0.6097560975609757|96.0
Clara Barton School|720|4600 Rosehill St, Philadelphia, PA 19120|757|Elementary School|District|||55.0||40.019449|-75.119497|0.33025099075297226|98.0
Laura H. Carnell School|722|1100 Devereaux Ave, Philadelphia, PA 19111|973|Elementary School|District|8.0|45.0|27.0|28|40.038753|-75.083243|1.2332990750256936|93.0
Ellwood School|726|6701 N 13th St, Philadelphia, PA 19126|315|Elementary School|District|12.0|40.0|41.0|31|40.054845|-75.1389|1.0317460317460316|94.0
Thomas K. Finletter School|727|6100 N Front St, Philadelphia, PA 19120|744|K8 School|District|19.0|56.0|37.0|39|40.04306|-75.119865|1.1088709677419355|93.0
Benjamin Franklin School|728|5735 Rising Sun Ave, Philadelphia, PA 19120|984|K8 School|District|8.0|63.0|40.0|39|40.0419915365854|-75.1055422926829|2.1595528455284554|87.0
Allen M. Stearne School|729|1655 Unity St, Philadelphia, PA 19124|563|K8 School|District|2.0|51.0|5.0|20|40.0122058979592|-75.0868138979592|1.1101243339253997|93.0
Francis Hopkinson School|730|4001 L St, Philadelphia, PA 19124|920|K8 School|District|5.0|51.0|29.0|30|40.00783|-75.102706|0.5434782608695652|97.0
Feltonville Intermediate School|731|238 E Wyoming Ave, Philadelphia, PA 19120|772|Elementary School|District|9.0|57.0|68.0|46|40.0182165|-75.0974689|0.5181347150259067|97.0
Julia W. Howe School|732|5800 N 13th St, Philadelphia, PA 19141|244|Elementary School|District|8.0|63.0|22.0|31|||0.9221311475409837|95.0
Henry W. Lawton School|733|6101 Jackson St, Philadelphia, PA 19135|758|Elementary School|District|15.0|1.0|30.0|14|40.02073805|-75.05935815|0.16490765171503957|99.0
James R. Lowell School|735|450 W Nedro Ave, Philadelphia, PA 19120|766|Elementary School|District|11.0|51.0|48.0|38|||0.26109660574412535|98.0
John Marshall School|736|4500 Griscom St, Philadelphia, PA 19124|425|Elementary School|District|2.0|3.0|13.0|6|40.014854|-75.086874|0.8823529411764706|95.0
Grover Washington, Jr. School|737|201 E Olney Ave, Philadelphia, PA 19120|541|Middle School|District|10.0|25.0|35.0|23|40.0350147676768|-75.1186482424242|3.188539741219963|81.0
Alexander K. McClure School|738|600 W Hunting Park Ave, Philadelphia, PA 19140|630|Elementary School|District|4.0|35.0|48.0|29|40.01534|-75.138165|0.7142857142857142|96.0
Andrew J. Morrison School|739|5100 N 3rd St, Philadelphia, PA 19120|723|K8 School|District|6.0|71.0|15.0|33|40.028542|-75.129404|1.3485477178423237|92.0
Olney School|740|5301 N Water St, Philadelphia, PA 19120|836|K8 School|District|17.0|90.0|47.0|54|40.030693|-75.121304|0.7775119617224879|95.0
James J. Sullivan School|743|5300 Ditman St, Philadelphia, PA 19124|764|Elementary School|District|8.0|40.0|18.0|23|40.015349|-75.066941|0.7853403141361255|95.0
Bayard Taylor School|744|3698 N Randolph St, Philadelphia, PA 19140|560|Elementary School|District|1.0|46.0|32.0|28|40.007411|-75.137982|0.5357142857142857|97.0
William H. Ziegler School|746|5935 Saul St, Philadelphia, PA 19149|543|K8 School|District|10.0|0.0|30.0|14|40.0301204864865|-75.0756170810811|1.0128913443830572|94.0
Bridesburg School|747|2824 Jenks St, Philadelphia, PA 19137|794|K8 School|District|30.0|76.0|44.0|52|40.0003716|-75.0666754|0.28337531486146095|98.0
Prince Hall School|749|6101 N Gratz St, Philadelphia, PA 19141|574|Elementary School|District|15.0|33.0|39.0|30|40.0478023|-75.1491980584641|0.5662020905923345|97.0
Feltonville School of Arts and Sciences|750|210 E Courtland St, Philadelphia, PA 19120|555|Middle School|District|3.0|75.0|53.0|46|||2.7027027027027026|84.0
Mary M. Bethune School|751|3301 Old York Rd, Philadelphia, PA 19140|721|K8 School|District|3.0|19.0|20.0|14|40.002827|-75.148722|0.7628294036061026|96.0
William Rowen School|753|6841 N 19th St, Philadelphia, PA 19126|495|Elementary School|District|19.0|8.0|46.0|23|40.0593200281937|-75.1486242780204|0.5555555555555556|97.0
Roberto Clemente School|773|122 W Erie Ave, Philadelphia, PA 19140|491|Middle School|District|0.0|0.0|14.0|4|||5.39714867617108|68.0
Abraham Lincoln High School|801|3201 Ryan Ave, Philadelphia, PA 19136|1527|High School|District|1.0|18.0|9.0|11|40.042985|-75.044728|3.1925343811394895|81.0
Northeast High School|802|1601 Cottman Ave, Philadelphia, PA 19111|3386|High School|District|20.0|44.0|50.0|37|40.055323|-75.073063|1.292085056113408|92.0
George Washington High School|803|10175 Bustleton Ave, Philadelphia, PA 19116|1314|High School|District|7.0|25.0|31.0|21|40.1248028|-75.0148674|4.280821917808218|75.0
Arts Academy at Benjamin Rush|804|11081 Knights Rd, Philadelphia, PA 19154|606|High School|District|52.0|41.0|76.0|56|40.082651|-74.975103|1.0313531353135312|94.0
Swenson Arts and Technology High School|809|2750 Red Lion Rd, Philadelphia, PA 19114|668|High School|District|15.0|20.0|65.0|31|40.080702|-74.9980292|1.1976047904191616|93.0
Woodrow Wilson School|812|1800 Cottman Ave, Philadelphia, PA 19111|1299|Middle School|District|12.0|40.0|54.0|36|40.0524587|-75.0692024117947|2.2324865280985375|87.0
Austin Meehan School|814|3001 Ryan Ave, Philadelphia, PA 19152|578|Middle School|District|5.0|0.0|33.0|12|40.046383|-75.045168|3.2439446366782008|81.0
Baldi School|816|8801 Verree Rd, Philadelphia, PA 19115|1379|Middle School|District|49.0|73.0|71.0|65|40.0932796|-75.0522046|0.4532269760696156|97.0
Ethan Allen School |820|6329 Battersby St, Philadelphia, PA 19149|945|K8 School|District|12.0|55.0|39.0|37|40.029414|-75.062691|0.7936507936507937|95.0
Joseph H. Brown School|821|3600 Stanwood St, Philadelphia, PA 19136|581|Elementary School|District|20.0|81.0|36.0|48|40.043828|-75.024555|0.21514629948364886|99.0
Kennedy C. Crossan School|823|7350 Bingham St, Philadelphia, PA 19111|375|Elementary School|District|32.0|10.0|70.0|36|40.061432755102|-75.0815740816327|0.06666666666666667|100.0
Hamilton Disston School|824|6801 Cottage St, Philadelphia, PA 19135|880|K8 School|District|8.0|53.0|14.0|27|40.028295|-75.04726|0.9375|94.0
Edwin Forrest School|825|7300 Cottage St, Philadelphia, PA 19136|1186|Elementary School|District|18.0|4.0|41.0|19|40.033445|-75.03768|0.16863406408094436|99.0
Fox Chase School|826|500 Rhawn St, Philadelphia, PA 19111|485|Elementary School|District|40.0|36.0|81.0|51|40.076186|-75.081548|0.05154639175257732|100.0
Thomas Holme School|827|9125 Academy Rd, Philadelphia, PA 19114|570|Elementary School|District|42.0|75.0|57.0|59|40.0588613333333|-75.0088144166667|0.5263157894736842|97.0
Mayfair School|830|3001 Princeton Ave, Philadelphia, PA 19149|1421|K8 School|District|35.0|3.0|59.0|30|40.039375|-75.053252|0.8796622097114708|95.0
J. Hampton Moore School|831|6900 Summerdale Ave, Philadelphia, PA 19111|1168|Elementary School|District|26.0|70.0|74.0|58|40.04878|-75.076834|0.17123287671232879|99.0
Solomon Solis-Cohen School|834|7001 Horrocks St, Philadelphia, PA 19149|1221|Elementary School|District|21.0|27.0|66.0|37|40.044791|-75.066365|0.3276003276003276|98.0
Gilbert Spruance School|835|6401 Horrocks St, Philadelphia, PA 19149|1504|K8 School|District|12.0|10.0|41.0|20|40.037352|-75.07337|0.581781914893617|97.0
Rhawnhurst School|836|7809 Castor Ave, Philadelphia, PA 19152|607|Elementary School|District|28.0|28.0|92.0|48|40.0584676|-75.0577569635171|0.08237232289950576|100.0
Watson Comly School|837|1001 Byberry Rd, Philadelphia, PA 19116|491|Elementary School|District|55.0|5.0|81.0|44|40.120669|-75.01026|0.7637474541751528|96.0
Louis H. Farrell School|838|8300 Castor Ave, Philadelphia, PA 19152|1088|K8 School|District|25.0|44.0|72.0|47|40.0662654651163|-75.0521104186047|0.2297794117647059|99.0
A.L. Fitzpatrick School|839|11061 Knights Rd, Philadelphia, PA 19154|830|K8 School|District|27.0|69.0|42.0|48|40.08103|-74.976859|0.7831325301204819|95.0
Anne Frank School|840|2000 Bowler St, Philadelphia, PA 19115|1284|Elementary School|District|64.0|81.0|88.0|78|40.088645|-75.028671|0.0778816199376947|100.0
Robert B. Pollock School|841|2875 Welsh Rd, Philadelphia, PA 19152|663|Elementary School|District|40.0|67.0|53.0|55|40.0624436666667|-75.028053|0.6033182503770739|96.0
Stephen Decatur School|842|3500 Academy Rd, Philadelphia, PA 19154|1029|K8 School|District|35.0|72.0|64.0|58|40.091517|-74.9656466|0.17006802721088438|99.0
Joseph Greenberg School|843|600 Sharon Ln, Philadelphia, PA 19115|753|K8 School|District|75.0|65.0|88.0|75|40.09604|-75.057636|0.099601593625498|99.0
William H. Loesche School|844|595 Tomlinson Rd, Philadelphia, PA 19116|769|Elementary School|District|57.0|62.0|82.0|67|40.1135619130435|-75.023832|0.2925877763328999|98.0
The Workshop School|856|221 S Hanson St, Philadelphia, PA 19139|230|High School|District|0.0|29.0|63.0|32|39.9557779387755|-75.2185873877551|0.32608695652173914|98.0
John Hancock Demonstration School|877|3700 Morrell Ave, Philadelphia, PA 19114|739|K8 School|District|50.0|58.0|62.0|56|40.06737345|-74.9891996744197|0.33829499323410017|98.0
Community Academy of Philadelphia Charter School |W01|1100 E Erie Ave, Philadelphia, PA 19124|600|High School|Charter|18.0|79.0|74.0|59||||
Community Academy of Philadelphia Charter School |W01|1100 E Erie Ave, Philadelphia, PA 19124|600|High School|Charter|11.0|81.0|66.0|53||||
Community Academy of Philadelphia Charter School |W01|1100 E Erie Ave, Philadelphia, PA 19124|621|K8 School|Charter|18.0|79.0|74.0|59||||
Community Academy of Philadelphia Charter School |W01|1100 E Erie Ave, Philadelphia, PA 19124|621|K8 School|Charter|11.0|81.0|66.0|53||||
Harambee Institute of Science and Technology Charter School|W02|640 N 66th St, Philadelphia, PA 19151|486|K8 School|Charter|13.0|39.0|81.0|44|39.9732138|-75.2520839108108||
Christopher Columbus Charter School|W06|916 Christian St, Philadelphia, PA 19147|818|K8 School|Charter|48.0|77.0|93.0|74|39.9479577|-75.2314136||
Eugenio Maria De Hostos Charter School|W07|6301 N 2nd St, Philadelphia, PA 19120|506|K8 School|Charter|33.0|43.0|82.0|52|40.046674|-75.123209||
Inquiry Charter School|W08|1301 Belmont Ave, Philadelphia, PA 19104|190|Elementary School|Charter|||71.0|Not Eligible|39.974859|-75.212543||
Imhotep Institute Charter High School|W09|6201 N 21st St, Philadelphia, PA 19138|579|High School|Charter|0.0|40.0|43.0|29|40.04969|-75.155388||
Laboratory Charter School of Communication and Languages|W10|800 North Orianna St, Philadelphia, PA 19123|633|K8 School|Charter|44.0|16.0|42.0|32||||
Multicultural Academy Charter School|W12|3821 N Broad St, Philadelphia, PA 19140|270|High School|Charter|8.0|93.0|82.0|59|40.0112002857143|-75.1506985306122||
Preparatory Charter School of Mathematics, Science, Technology and Careers|W13|1928 Point Breeze Ave, Philadelphia, PA 19145|578|High School|Charter|9.0|29.0|55.0|32|39.9286447022384|-75.185189241095||
West Oak Lane Charter School|W14|7115 Stenton Ave, Philadelphia, PA 19138|1063|K8 School|Charter|23.0|26.0|70.0|39|40.057566|-75.161948||
Alliance For Progress Charter School|W15|1821 N Cecil B Moore Ave, Philadelphia, PA 19121|447|K8 School|Charter|32.0|31.0|81.0|49||||
Architecture and Design Charter School|W17|105 S 7th St, Philadelphia, PA 19106|538|High School|Charter|0.0|37.0|35.0|26|39.949275|-75.1522612040816||
Freire Charter School|W18|2027 Chestnut St, Philadelphia, PA 19103|510|High School|Charter|15.0|100.0|71.0|66|39.9522059935338|-75.1740547635553||
Freire Charter School|W18|2027 Chestnut St, Philadelphia, PA 19103|510|High School|Charter|20.0|83.0|49.0|53|39.9522059935338|-75.1740547635553||
Freire Charter School|W18|2027 Chestnut St, Philadelphia, PA 19103|502|Middle School|Charter|15.0|100.0|71.0|66|39.9522059935338|-75.1740547635553||
Freire Charter School|W18|2027 Chestnut St, Philadelphia, PA 19103|502|Middle School|Charter|20.0|83.0|49.0|53|39.9522059935338|-75.1740547635553||
Math, Civics and Sciences Charter School|W21|447 N Broad St, Philadelphia, PA 19123|304|High School|Charter|0.0|31.0|68.0|31|39.9611527333333|-75.1615079333333||
Math, Civics and Sciences Charter School|W21|447 N Broad St, Philadelphia, PA 19123|304|High School|Charter|15.0|43.0|69.0|44|39.9611527333333|-75.1615079333333||
Math, Civics and Sciences Charter School|W21|447 N Broad St, Philadelphia, PA 19123|698|K8 School|Charter|0.0|31.0|68.0|31|39.9611527333333|-75.1615079333333||
Math, Civics and Sciences Charter School|W21|447 N Broad St, Philadelphia, PA 19123|698|K8 School|Charter|15.0|43.0|69.0|44|39.9611527333333|-75.1615079333333||
Philadelphia Academy Charter School|W22|11000 Roosevelt Blvd, Philadelphia, PA 19116|432|High School|Charter|65.0|81.0|96.0|81|40.1058477|-75.0004784||
Philadelphia Academy Charter School|W22|11000 Roosevelt Blvd, Philadelphia, PA 19116|432|High School|Charter|15.0|37.0|67.0|40|40.1058477|-75.0004784||
Philadelphia Academy Charter School|W22|11000 Roosevelt Blvd, Philadelphia, PA 19116|716|K8 School|Charter|65.0|81.0|96.0|81|40.1058477|-75.0004784||
Philadelphia Academy Charter School|W22|11000 Roosevelt Blvd, Philadelphia, PA 19116|716|K8 School|Charter|15.0|37.0|67.0|40|40.1058477|-75.0004784||
Mastery Charter School at Hardy Williams|W23|5400 Warrington Ave, Philadelphia, PA 19143|375|High School|Charter|4.0|41.0|37.0|30|39.9415018|-75.2268478||
Mastery Charter School at Hardy Williams|W23|5400 Warrington Ave, Philadelphia, PA 19143|375|High School|Charter|18.0|41.0|49.0|36|39.9415018|-75.2268478||
Mastery Charter School at Hardy Williams|W23|5400 Warrington Ave, Philadelphia, PA 19143|826|K8 School|Charter|4.0|41.0|37.0|30|39.9415018|-75.2268478||
Mastery Charter School at Hardy Williams|W23|5400 Warrington Ave, Philadelphia, PA 19143|826|K8 School|Charter|18.0|41.0|49.0|36|39.9415018|-75.2268478||
Universal Institute Charter School|W26|800 S 15th St, Philadelphia, PA 19146|671|K8 School|Charter|20.0|81.0|53.0|53|39.913208|-75.173842||
Mathematics, Science, and Technology Community Charter School (MaST)|W28|1800 E Byberry Rd, Philadelphia, PA 19116|425|High School|Charter|45.0|52.0|80.0|59||||
Mathematics, Science, and Technology Community Charter School (MaST)|W28|1800 E Byberry Rd, Philadelphia, PA 19116|425|High School|Charter|73.0|14.0|97.0|58||||
Mathematics, Science, and Technology Community Charter School (MaST)|W28|1800 E Byberry Rd, Philadelphia, PA 19116|904|K8 School|Charter|45.0|52.0|80.0|59||||
Mathematics, Science, and Technology Community Charter School (MaST)|W28|1800 E Byberry Rd, Philadelphia, PA 19116|904|K8 School|Charter|73.0|14.0|97.0|58||||
Young Scholars Charter School|W29|900 N Marshall St, Philadelphia, PA 19123|257|Middle School|Charter|24.0|83.0|93.0|69||||
Franklin Towne Charter High School|W31|5301 Tacony St, Philadelphia, PA 19137|1193|High School|Charter|67.0|93.0|90.0|82|40.0087958580304|-75.0682888710499||
Mariana Bracetti Academy Charter School|W32|1840 Torresdale Ave, Philadelphia, PA 19124|585|High School|Charter|27.0|95.0|62.0|61|40.005979|-75.0950679183673||
Mariana Bracetti Academy Charter School|W32|1840 Torresdale Ave, Philadelphia, PA 19124|585|High School|Charter|16.0|63.0|58.0|47|40.005979|-75.0950679183673||
Mariana Bracetti Academy Charter School|W32|1840 Torresdale Ave, Philadelphia, PA 19124|622|K8 School|Charter|27.0|95.0|62.0|61|40.005979|-75.0950679183673||
Mariana Bracetti Academy Charter School|W32|1840 Torresdale Ave, Philadelphia, PA 19124|622|K8 School|Charter|16.0|63.0|58.0|47|40.005979|-75.0950679183673||
Esperanza Academy Charter School|W33|301 W Hunting Park Ave, Philadelphia, PA 19140|768|High School|Charter|5.0|100.0|58.0|57|40.014933|-75.1328195247609||
Esperanza Academy Charter School|W33|301 W Hunting Park Ave, Philadelphia, PA 19140|768|High School|Charter|10.0|88.0|53.0|53|40.014933|-75.1328195247609||
Esperanza Academy Charter School|W33|301 W Hunting Park Ave, Philadelphia, PA 19140|660|Middle School|Charter|5.0|100.0|58.0|57|40.014933|-75.1328195247609||
Esperanza Academy Charter School|W33|301 W Hunting Park Ave, Philadelphia, PA 19140|660|Middle School|Charter|10.0|88.0|53.0|53|40.014933|-75.1328195247609||
New Foundations Charter School|W34|8001 Torresdale Ave, Philadelphia, PA 19136|760|High School|Charter|25.0|49.0|69.0|46|40.035281|-75.02499||
New Foundations Charter School|W34|8001 Torresdale Ave, Philadelphia, PA 19136|760|High School|Charter|54.0|16.0|88.0|50|40.035281|-75.02499||
New Foundations Charter School|W34|8001 Torresdale Ave, Philadelphia, PA 19136|716|K8 School|Charter|25.0|49.0|69.0|46|40.035281|-75.02499||
New Foundations Charter School|W34|8001 Torresdale Ave, Philadelphia, PA 19136|716|K8 School|Charter|54.0|16.0|88.0|50|40.035281|-75.02499||
People for People Charter School|W35|800 N Broad St, Philadelphia, PA 19130|515|K8 School|Charter|5.0|48.0|42.0|33||||
Philadelphia Performing Arts: A String Theory Charter School|W36|2600 S Broad St, Philadelphia, PA 19145|799|High School|Charter|23.0|60.0|74.0|52||||
Philadelphia Performing Arts: A String Theory Charter School|W36|2600 S Broad St, Philadelphia, PA 19145|799|High School|Charter|46.0|75.0|78.0|67||||
Philadelphia Performing Arts: A String Theory Charter School|W36|2600 S Broad St, Philadelphia, PA 19145|1753|K8 School|Charter|23.0|60.0|74.0|52||||
Philadelphia Performing Arts: A String Theory Charter School|W36|2600 S Broad St, Philadelphia, PA 19145|1753|K8 School|Charter|46.0|75.0|78.0|67||||
Global Leadership Academy Charter School|W37|4601 W Girard Ave, Philadelphia, PA 19131|698|K8 School|Charter|11.0|23.0|76.0|36|39.973118|-75.21406||
Independence Charter School|W41|1600 Lombard St, Philadelphia, PA 19146|801|K8 School|Charter|55.0|47.0|92.0|63|39.944995|-75.168713||
Khepera Charter School|W50|926 W Sedgley Ave, Philadelphia, PA 19119|451|K8 School|Charter|0.0|1.0|11.0|4|40.001715|-75.144958||
KIPP DuBois Charter School|W53|5070 Parkside Ave, Philadelphia, PA 19131|522|High School|Charter|2.0|35.0|50.0|29|39.980419|-75.2208084285714||
Philadelphia Electrical and Technology Charter School|W58|1420 Chestnut St, Philadelphia, PA 19102|613|High School|Charter|7.0|88.0|36.0|47|39.9508456326531|-75.1644474285714||
Richard Allen Preparatory Charter School|W59|2601 S 58th St, Philadelphia, PA 19143|481|Middle School|Charter|4.0|21.0|36.0|20|39.928026|-75.219118||
Russell Byers Charter School|W60|1911 Arch St, Philadelphia, PA 19103|485|Elementary School|Charter|37.0|2.0|83.0|38|39.95585225|-75.1716192829961||
Mastery Charter School at Lenfest Campus|W61|35 S 4th St, Philadelphia, PA 19106|357|High School|Charter|13.0|49.0|50.0|40||||
Mastery Charter School at Lenfest Campus|W61|35 S 4th St, Philadelphia, PA 19106|357|High School|Charter|11.0|38.0|24.0|25||||
Mastery Charter School at Lenfest Campus|W61|35 S 4th St, Philadelphia, PA 19106|228|Middle School|Charter|13.0|49.0|50.0|40||||
Mastery Charter School at Lenfest Campus|W61|35 S 4th St, Philadelphia, PA 19106|228|Middle School|Charter|11.0|38.0|24.0|25||||
Wissahickon Charter School|W62|4700 Wissahickon Ave, Philadelphia, PA 19144|948|K8 School|Charter|25.0|36.0|75.0|45|40.0169754|-75.1725506||
First Philadelphia Preparatory Charter School|W64|4300 Tacony St, Philadelphia, PA 19124|328|High School|Charter|16.0|64.0|47.0|44|40.006894|-75.082723||
First Philadelphia Preparatory Charter School|W64|4300 Tacony St, Philadelphia, PA 19124|328|High School|Charter|2.0|32.0|40.0|25|40.006894|-75.082723||
First Philadelphia Preparatory Charter School|W64|4300 Tacony St, Philadelphia, PA 19124|1529|K8 School|Charter|16.0|64.0|47.0|44|40.006894|-75.082723||
First Philadelphia Preparatory Charter School|W64|4300 Tacony St, Philadelphia, PA 19124|1529|K8 School|Charter|2.0|32.0|40.0|25|40.006894|-75.082723||
Green Woods Charter School|W65|468 Domino Lane, Philadelphia, PA 19128|674|K8 School|Charter|65.0|95.0|86.0|83|40.0446463972691|-75.2334205664175||
Maritime Academy Charter School (MACHS)|W66|2275 Bridge St, Philadelphia, PA 19137|273|High School|Charter|28.0|69.0|76.0|59|40.00911424|-75.06891212||
Maritime Academy Charter School (MACHS)|W66|2275 Bridge St, Philadelphia, PA 19137|273|High School|Charter|15.0|42.0|65.0|37|40.00911424|-75.06891212||
Maritime Academy Charter School (MACHS)|W66|2275 Bridge St, Philadelphia, PA 19137|544|K8 School|Charter|28.0|69.0|76.0|59|40.00911424|-75.06891212||
Maritime Academy Charter School (MACHS)|W66|2275 Bridge St, Philadelphia, PA 19137|544|K8 School|Charter|15.0|42.0|65.0|37|40.00911424|-75.06891212||
Belmont Charter School|W68|4030 Brown St, Philadelphia, PA 19104|678|K8 School|Charter|10.0|0.0|42.0|16|39.9673323658537|-75.2045127926829||
KIPP Philadelphia Charter School|W70|2539 N 16th St, Philadelphia, PA 19132|793|K8 School|Charter|7.0|21.0|59.0|Closed|39.9924290612245|-75.1581080816326||
KIPP Philadelphia Charter School|W70|2539 N 16th St, Philadelphia, PA 19132|793|K8 School|Charter|21.0|2.0|53.0|24|39.9924290612245|-75.1581080816326||
Discovery Charter School|W72|4700 Parkside Ave, Philadelphia, PA 19131|736|K8 School|Charter|21.0|89.0|85.0|68|39.97777|-75.21366||
Philadelphia Montessori Charter School|W78|2227 Island Ave, Philadelphia, PA 19142|171|Elementary School|Charter|23.0|22.0|76.0|41|39.9170019795918|-75.2460402040816||
Ad Prima Charter School|W79|1922 N 63rd St, Philadelphia, PA 19151|666|K8 School|Charter|26.0|10.0|66.0|32|39.9839775306122|-75.2472746326531||
Mastery Charter School at Shoemaker Campus|W83|5301 Media St, Philadelphia, PA 19131|529|High School|Charter|16.0|90.0|66.0|60|39.9754707244898|-75.228993122449||
Mastery Charter School at Shoemaker Campus|W83|5301 Media St, Philadelphia, PA 19131|529|High School|Charter|5.0|51.0|68.0|40|39.9754707244898|-75.228993122449||
Mastery Charter School at Shoemaker Campus|W83|5301 Media St, Philadelphia, PA 19131|258|Middle School|Charter|16.0|90.0|66.0|60|39.9754707244898|-75.228993122449||
Mastery Charter School at Shoemaker Campus|W83|5301 Media St, Philadelphia, PA 19131|258|Middle School|Charter|5.0|51.0|68.0|40|39.9754707244898|-75.228993122449||
Folks Arts Culture Treasures Charter School|W84|1023 Callowhill St, Philadelphia, PA 19123|484|K8 School|Charter|68.0|74.0|95.0|79|39.958416|-75.152749||
Mastery Charter School at Thomas Campus|W85|927 Johnston St, Philadelphia, PA 19148|448|High School|Charter|9.0|25.0|50.0|27|39.914553|-75.163735||
Mastery Charter School at Thomas Campus|W85|927 Johnston St, Philadelphia, PA 19148|448|High School|Charter|25.0|56.0|58.0|47|39.914553|-75.163735||
Mastery Charter School at Thomas Campus|W85|927 Johnston St, Philadelphia, PA 19148|890|K8 School|Charter|9.0|25.0|50.0|27|39.914553|-75.163735||
Mastery Charter School at Thomas Campus|W85|927 Johnston St, Philadelphia, PA 19148|890|K8 School|Charter|25.0|56.0|58.0|47|39.914553|-75.163735||
Northwood Academy Charter School|W86|4621 Castor Ave, Philadelphia, PA 19124|793|K8 School|Charter|39.0|27.0|81.0|48|40.0191436|-75.0963433||
Boys Latin of Philadelphia Charter School|W88|5501 Cedar Ave, Philadelphia, PA 19143|445|High School|Charter|3.0|48.0|67.0|36|39.951287|-75.232933||
Boys Latin of Philadelphia Charter School|W88|5501 Cedar Ave, Philadelphia, PA 19143|445|High School|Charter|4.0|47.0|47.0|34|39.951287|-75.232933||
Boys Latin of Philadelphia Charter School|W88|5501 Cedar Ave, Philadelphia, PA 19143|360|Middle School|Charter|3.0|48.0|67.0|36|39.951287|-75.232933||
Boys Latin of Philadelphia Charter School|W88|5501 Cedar Ave, Philadelphia, PA 19143|360|Middle School|Charter|4.0|47.0|47.0|34|39.951287|-75.232933||
Keystone Academy Charter School|W89|4521 Longshore Ave, Philadelphia, PA 19135|670|K8 School|Charter|47.0|70.0|76.0|65|40.0274530816327|-75.044271||
Southwest Leadership Academy Charter School|W92|7101 Paschall Ave, Philadelphia, PA 19142|482|K8 School|Charter|20.0|29.0|85.0|44|39.918441|-75.241995||
Mastery Charter School at Pickett Campus|W93|5700 Wayne Ave, Philadelphia, PA 19144|468|High School|Charter|7.0|65.0|33.0|39|40.03187625|-75.18193615||
Mastery Charter School at Pickett Campus|W93|5700 Wayne Ave, Philadelphia, PA 19144|468|High School|Charter|3.0|68.0|24.0|35|40.03187625|-75.18193615||
Mastery Charter School at Pickett Campus|W93|5700 Wayne Ave, Philadelphia, PA 19144|427|Middle School|Charter|7.0|65.0|33.0|39|40.03187625|-75.18193615||
Mastery Charter School at Pickett Campus|W93|5700 Wayne Ave, Philadelphia, PA 19144|427|Middle School|Charter|3.0|68.0|24.0|35|40.03187625|-75.18193615||
Pan American Academy Charter School|W94|2830 N American St, Philadelphia, PA 19133|726|K8 School|Charter|13.0|56.0|72.0|47||||
Antonia Pantoja Charter School|W95|4101 N American St, Philadelphia, PA 19140|711|K8 School|Charter|23.0|88.0|80.0|65|40.01307675|-75.1308000395108||
KIPP West Philadelphia Preparatory Charter School|W96|5900 Baltimore Ave, Philadelphia, PA 19143|361|Middle School|Charter|8.0|82.0|58.0|52|39.945169|-75.241869||
