School|School ID|Full Address|Enrollment|Rpt Type Long|Governance|Achievement_Score_Final|Progress_Score_Final|Climate_Score_Final|Overall_Score_Final|Latitude|Longitude|SafetyIncidentRate|SafetyScore
Eastern University Academy Charter School|W97|3300 Henry Ave, Philadelphia, PA 19129|239|High School|Charter|0.0|25.0|43.0|23|40.0105564141414|-75.1813271212121||
Eastern University Academy Charter School|W97|3300 Henry Ave, Philadelphia, PA 19129|239|High School|Charter|3.0|47.0|42.0|29|40.0105564141414|-75.1813271212121||
Eastern University Academy Charter School|W97|3300 Henry Ave, Philadelphia, PA 19129|110|Middle School|Charter|0.0|25.0|43.0|23|40.0105564141414|-75.1813271212121||
Eastern University Academy Charter School|W97|3300 Henry Ave, Philadelphia, PA 19129|110|Middle School|Charter|3.0|47.0|42.0|29|40.0105564141414|-75.1813271212121||
Sankofa Freedom Academy Charter School|W99|2501 Kensington Ave, Philadelphia, PA 19125|194|High School|Charter|10.0|79.0|28.0|39|39.988177|-75.12831||
Sankofa Freedom Academy Charter School|W99|2501 Kensington Ave, Philadelphia, PA 19125|194|High School|Charter|2.0|66.0|31.0|35|39.988177|-75.12831||
Sankofa Freedom Academy Charter School|W99|2501 Kensington Ave, Philadelphia, PA 19125|461|K8 School|Charter|10.0|79.0|28.0|39|39.988177|-75.12831||
Sankofa Freedom Academy Charter School|W99|2501 Kensington Ave, Philadelphia, PA 19125|461|K8 School|Charter|2.0|66.0|31.0|35|39.988177|-75.12831||
Franklin Towne Charter Elementary School|X03|4259 Richmond St, Philadelphia, PA 19137|910|K8 School|Charter|62.0|84.0|89.0|79|39.9959146938776|-75.076016122449||
Tacony Academy Charter School|X04|1330 Rhawn St, Philadelphia, PA 19111|389|High School|Charter|36.0|74.0|66.0|60|40.069258826087|-75.0686282173913||
Tacony Academy Charter School|X04|1330 Rhawn St, Philadelphia, PA 19111|389|High School|Charter|0.0|48.0|53.0|32|40.069258826087|-75.0686282173913||
Tacony Academy Charter School|X04|1330 Rhawn St, Philadelphia, PA 19111|690|K8 School|Charter|36.0|74.0|66.0|60|40.069258826087|-75.0686282173913||
Tacony Academy Charter School|X04|1330 Rhawn St, Philadelphia, PA 19111|690|K8 School|Charter|0.0|48.0|53.0|32|40.069258826087|-75.0686282173913||
Aspira Charter School at Stetson|X06|3200 B St, Philadelphia, PA 19134|891|Middle School|Charter|0.0|73.0|46.0|42|39.998178|-75.125461||
Mastery Charter School at Harrity|X07|5601 Christian St, Philadelphia, PA 19143|845|K8 School|Charter|19.0|87.0|39.0|52|39.948534|-75.23562||
Mastery Charter School at Mann|X08|5376 W Berks St, Philadelphia, PA 19131|550|Elementary School|Charter|35.0|85.0|48.0|58|39.9859157407407|-75.2312900740741||
Mastery Charter School at Smedley|X09|1790 Bridge St, Philadelphia, PA 19124|778|Elementary School|Charter|28.0|34.0|55.0|39|40.0202886129032|-75.0740681612903||
Universal Charter School at Bluford|X10|5720 Media St, Philadelphia, PA 19131|534|Elementary School|Charter|20.0|97.0|87.0|71|39.974802|-75.2352648367347||
Universal Charter School at Daroff|X11|5630 Vine St, Philadelphia, PA 19139|680|K8 School|Charter|7.0|10.0|29.0|15|39.9655972040816|-75.2325854897959||
Frederick Douglass Mastery Charter School|X12|2118 W Norris St, Philadelphia, PA 19121|762|K8 School|Charter|5.0|73.0|18.0|35|39.9867284|-75.1841343||
Aspira Charter School at Olney|X14|100 W Duncannon Ave, Philadelphia, PA 19120|1790|High School|Charter|0.0|27.0|41.0|20||||
Mastery Charter School at Clymer|X15|1201 W Rush St, Philadelphia, PA 19133|542|Elementary School|Charter|17.0|76.0|58.0|53|39.995671|-75.150488||
Mastery Charter School at Gratz|X16|1798 W Hunting Park Ave, Philadelphia, PA 19140|1183|High School|Charter|9.0|75.0|34.0|43|40.014611|-75.156459||
Mastery Charter School at Gratz|X16|1798 W Hunting Park Ave, Philadelphia, PA 19140|1183|High School|Charter|0.0|20.0|14.0|12|40.014611|-75.156459||
Mastery Charter School at Gratz|X16|1798 W Hunting Park Ave, Philadelphia, PA 19140|322|Middle School|Charter|9.0|75.0|34.0|43|40.014611|-75.156459||
Mastery Charter School at Gratz|X16|1798 W Hunting Park Ave, Philadelphia, PA 19140|322|Middle School|Charter|0.0|20.0|14.0|12|40.014611|-75.156459||
Universal Charter School at Audenried|X17|3301 Tasker St, Philadelphia, PA 19145|612|High School|Charter|0.0|19.0|58.0|22|39.934558|-75.199304||
Universal Charter School at Vare|X18|2100 S 24th St, Philadelphia, PA 19145|395|Middle School|Charter|7.0|89.0|29.0|45||||
General David B.BirneyCharter School|X19|900 Lindley Ave, Philadelphia, PA 19141|741|K8 School|Charter|8.0|65.0|41.0|41|40.029575|-75.138993||
Mastery Charter School at Cleveland|X20|3701 N 19th St, Philadelphia, PA 19140|770|K8 School|Charter|12.0|67.0|41.0|42|40.010394|-75.159043||
Universal Charter School at Creighton|X21|5401 Tabor Ave, Philadelphia, PA 19120|757|K8 School|Charter|34.0|93.0|61.0|65|40.034148|-75.105752||
Philadelphia Charter School for the Arts and Sciences|X22|1197 Haworth St, Philadelphia, PA 19124|959|K8 School|Charter|16.0|32.0|56.0|34|40.02491115|-75.0866203292728||
Memphis Street Academy Charter School at J.P. Jones|X23|2950 Memphis St, Philadelphia, PA 19134|847|Middle School|Charter|1.0|94.0|35.0|47|39.9858767142857|-75.1128803265306||
Universal Charter School at Alcorn|X24|3200 Dickinson St, Philadelphia, PA 19146|615|K8 School|Charter|15.0|83.0|62.0|56|39.935393|-75.197442||
Mastery Charter School at Pastorius |X26|5650 Sprague St, Philadelphia, PA 19138|563|K8 School|Charter|8.0|29.0|30.0|23|40.0475195306122|-75.1601147346939||
Mastery Charter School at Wister|X27|67 E Bringhurst St, Philadelphia, PA 19144|515|Elementary School|Charter|7.0|51.0|27.0|31|40.0322743333333|-75.167095||
Global Leadership Academy at Huey|X28|5200 Pine St, Philadelphia, PA 19143|511|K8 School|Charter|1.0|22.0|49.0|24|39.953465|-75.226398||
MaST Community Charter School II|X40|6238 Rising Sun Ave, Philadelphia, PA 19111|394|Elementary School|Charter|56.0||93.0|75|40.0473987142857|-75.0978675306122||
TECH Freire Charter School|X41|2221 N Broad St, Philadelphia, PA 19132|304|High School|Charter|1.0|28.0|12.0|15|39.9866667142857|-75.1560840204082||
Independence Charter School West|X42|5600 Chester Ave, Philadelphia, PA 19143|300|Elementary School|Charter|20.0||88.0|57|39.937247|-75.226226||
